{
  "plugin": "C:/Users/Administrator/AppData/Local/Temp/cand-navbar/vlln-dsh-navbar-10e9d15",
  "repo": "C:\\Users\\Administrator\\Desktop\\ds\\deepseek-harness",
  "date": "2026-08-15T18:44:53.481Z",
  "pass": true,
  "waterfallFound": [
    "system-prompt/assemble",
    "agent/pre-step",
    "agent/request",
    "llm/stream",
    "tools/pre-execute",
    "tools/execute",
    "tools/post-execute"
  ],
  "waterfallMissing": [],
  "rules": [
    {
      "name": "R1-entry-shape",
      "pass": true,
      "detail": "入口 C:\\Users\\Administrator\\AppData\\Local\\Temp\\cand-navbar\\vlln-dsh-navbar-10e9d15\\lib\\index.mjs：未见 namespace 形式（name+apply），静态形态检查不适用（default=null）"
    },
    {
      "name": "R2-patch-yaml",
      "pass": true,
      "detail": "patch ./cordis.patch.yml：!!js 表达式均位于 config 子树（5 行）"
    },
    {
      "name": "P202-spawn-usage",
      "pass": true,
      "detail": "P-202 未见裸 child_process spawn（无导入或仅封装调用）"
    },
    {
      "name": "P401-single-slot",
      "pass": true,
      "detail": "P-401 未见 single 槽注册（slots.register 未命中官方 single 槽清单）"
    },
    {
      "name": "R3-tools-result",
      "pass": true,
      "detail": "工具真实执行成功（1 次结果，无 isError）"
    }
  ],
  "detail": "捕获事件: 13 | waterfall: 7/7 | tools/result: 是",
  "fullName": "vlln/dsh-navbar",
  "verifiedBy": "dsh-plugin-verify@0.1.2",
  "schemaVersion": 1,
  "reportUrl": "https://github.com/qing3a/dsh-plugin-verify/blob/main/reports/navbar-2026-08-16.json",
  "security": {
    "status": "clean",
    "warnings": []
  }
}
