{
  "plugin": "C:\\Users\\Administrator\\AppData\\Local\\Temp\\sentinel-check\\dsh-sentinel",
  "repo": "C:\\Users\\Administrator\\Desktop\\ds\\deepseek-harness",
  "date": "2026-08-15T18:24:11.067Z",
  "pass": true,
  "waterfallFound": [
    "system-prompt/assemble",
    "agent/pre-step",
    "agent/request",
    "llm/stream",
    "tools/pre-execute",
    "tools/execute",
    "tools/post-execute"
  ],
  "waterfallMissing": [],
  "rules": [
    {
      "name": "R1-entry-shape",
      "pass": true,
      "detail": "入口 C:\\Users\\Administrator\\AppData\\Local\\Temp\\sentinel-check\\dsh-sentinel\\lib\\index.js：未见 namespace 形式（name+apply），静态形态检查不适用（default=null）"
    },
    {
      "name": "R2-patch-yaml",
      "pass": true,
      "detail": "patch ./cordis.patch.yml：!!js 表达式均位于 config 子树（5 行）"
    },
    {
      "name": "P202-spawn-usage",
      "pass": true,
      "detail": "P-202 未见裸 child_process spawn（无导入或仅封装调用）"
    },
    {
      "name": "P401-single-slot",
      "pass": true,
      "warn": true,
      "detail": "⚠️ [SHOULD P-401] 1 处注册 single 槽——第三方 priority 恒低，注册即 shadow 官方 UI 并破坏其子槽声明（如 sidebar.workspaces.directoryFlow 链路）: src\\client\\index.tsx 注册 sidebar.workspaces.sessionRow.branch"
    },
    {
      "name": "R3-tools-result",
      "pass": true,
      "detail": "工具真实执行成功（1 次结果，无 isError）"
    }
  ],
  "detail": "捕获事件: 13 | waterfall: 7/7 | tools/result: 是",
  "fullName": "fuhefei/dsh-sentinel",
  "verifiedBy": "dsh-plugin-verify@0.1.2",
  "schemaVersion": 1,
  "reportUrl": "https://github.com/qing3a/dsh-plugin-verify/blob/main/reports/sentinel-2026-08-16.json",
  "security": {
    "status": "warnings",
    "warnings": [
      {
        "rule": "P401-single-slot",
        "detail": "⚠️ [SHOULD P-401] 1 处注册 single 槽——第三方 priority 恒低，注册即 shadow 官方 UI 并破坏其子槽声明（如 sidebar.workspaces.directoryFlow 链路）: src\\client\\index.tsx 注册 sidebar.workspaces.s"
      }
    ]
  }
}
