{
  "plugin": "C:/Users/Administrator/Desktop/ds/_tmp_pilot/dsh-id",
  "repo": "C:/Users/Administrator/Desktop/ds/deepseek-harness",
  "fullName": "jiangxingfan1-coder/dsh-id",
  "date": "2026-08-16T14:57:44.057Z",
  "pass": true,
  "verifiedBy": "dsh-plugin-verify@0.1.2",
  "schemaVersion": 1,
  "waterfallFound": [
    "system-prompt/assemble",
    "agent/pre-step",
    "agent/request",
    "llm/stream",
    "tools/pre-execute",
    "tools/execute",
    "tools/post-execute"
  ],
  "waterfallMissing": [],
  "rules": [
    {
      "name": "R1-entry-shape",
      "pass": false,
      "detail": "package.json 未声明 main（无法定位入口做静态检查）"
    },
    {
      "name": "R2-patch-yaml",
      "pass": true,
      "detail": "patch ./cordis.patch.yml：!!js 表达式均位于 config 子树（17 行）"
    },
    {
      "name": "P202-spawn-usage",
      "pass": true,
      "detail": "P-202 无法定位入口，跳过"
    },
    {
      "name": "P401-single-slot",
      "pass": true,
      "detail": "P-401 无法定位入口，跳过"
    },
    {
      "name": "R3-tools-result",
      "pass": true,
      "detail": "工具真实执行成功（1 次结果，无 isError）"
    }
  ],
  "security": {
    "status": "clean",
    "warnings": []
  },
  "detail": "捕获事件: 13 | waterfall: 7/7 | tools/result: 是",
  "reportUrl": "https://github.com/qing3a/dsh-plugin-verify/blob/main/reports/dsh-id-2026-08-16.json"
}
